{
    "name": "Project_0",
    "version": "0.1.0",
    "type": "executable",
    "dependencies": [
        {
            "name": "Complex"
        }
    ],
    "sources": [
        {
            "type": "hlang",
            "include": [
                "./**/*.iris"
            ]
        }
    ],
    "executable": {
        "source": "main.iris",
        "entry_point": "project_0_main_main"
    }
}
