{
    "name": "my_library",
    "version": "0.1.0",
    "type": "library",
    "sources": [
        {
            "type": "iris",
            "include": [
                "./**/*.iris"
            ]
        }
    ],
    "copy": [
        {
            "source": "library_data/engine.txt",
            "destination": "engine/engine.txt"
        }
    ]
}
