{
    "name": "Hello_world",
    "version": "0.1.0",
    "type": "executable",
    "dependencies": [
        {
            "name": "C_standard_library"
        }
    ],
    "sources": [
        {
            "type": "hlang",
            "include": [
                "./**/*.hltxt"
            ]
        }
    ],
    "executable": {
        "source": "hello_world.hltxt"
    }
}