{
    "name": "decimal_app",
    "version": "0.1.0",
    "type": "executable",
    "dependencies": [
        {
            "name": "C_standard_library"
        }
    ],
    "sources": [
        {
            "type": "iris",
            "include": [
                "./**/*.iris"
            ]
        }
    ],
    "executable": {
        "source": "decimal_app.iris"
    }
}
