{
    "name": "empty_app",
    "version": "0.1.0",
    "type": "executable",
    "dependencies": [
        {
            "name": "my_library"
        }
    ],
    "sources": [
        {
            "type": "hlang",
            "include": [
                "./**/*.hltxt"
            ]
        }
    ],
    "executable": {
        "source": "empty_app.hltxt"
    }
}